{
  "schemaVersion": 1,
  "contentVersion": 6,
  "status": "editorial_draft",
  "questions": [
    {
      "id": "q001",
      "version": 2,
      "status": "editorial_draft",
      "kind": "choice",
      "title": "友人の秘密",
      "body": "友人から、共同制作を途中で辞めるつもりだと打ち明けられました。公表は来週まで待ってほしいと頼まれ、あなたは待つと約束しました。今日伝えれば仲間は余分な準備を避けられますが、友人は自分で説明する機会を失います。あなたならどうしますか。",
      "category": [
        "relationship"
      ],
      "axes": [
        "principle_outcome"
      ],
      "importance": 1,
      "scoringMode": "behavior",
      "options": [
        {
          "id": "A",
          "label": "来週まで秘密を守り、本人からの説明を待つ",
          "weights": {
            "principle_outcome": -0.7
          }
        },
        {
          "id": "B",
          "label": "準備への影響に限って、今日仲間に伝える",
          "weights": {
            "principle_outcome": 0.7
          }
        },
        {
          "id": "unsure",
          "label": "この条件だけでは決められない",
          "weights": {},
          "isNonAnswer": true
        }
      ],
      "reflection": {
        "summary": "秘密を守る約束と、周囲への影響を減らす判断が重なっています。",
        "perspectives": [
          "本人が説明する機会にも価値があります。",
          "早く情報を共有すると、周囲の負担を減らせます。"
        ],
        "question": "今回、どの条件が判断を左右しましたか。"
      },
      "relations": [],
      "followUps": [
        "fu_reason_conditions"
      ],
      "review": {
        "humanReviewed": false,
        "notes": [
          "2026-09-17 編集レビュー：公表を待つ約束を明示。公平↔関係の推測的な二重採点を外す。"
        ]
      }
    },
    {
      "id": "q002",
      "version": 2,
      "status": "editorial_draft",
      "kind": "choice",
      "title": "最後の薬",
      "body": "架空の救助拠点で、薬が一人分しかありません。専門家の見立てでは、同じ緊急度の二人のうち、一人は助かる確率が高く、もう一人は低めですが幼い家族を一人で支えています。追加の薬は間に合いません。配分の考え方として、どちらに近いですか。",
      "category": [
        "life"
      ],
      "axes": [
        "equality_efficiency"
      ],
      "importance": 1,
      "scoringMode": "behavior",
      "options": [
        {
          "id": "A",
          "label": "助かる確率が高い人を優先する",
          "weights": {}
        },
        {
          "id": "B",
          "label": "家族を支えている人を優先する",
          "weights": {}
        },
        {
          "id": "unsure",
          "label": "この条件だけでは決められない",
          "weights": {},
          "isNonAnswer": true
        }
      ],
      "reflection": {
        "summary": "助かる見込みと、その人が支える家族への影響を比べる架空の問いです。選んだ相手から、公平さや人の命の価値についての考えを決めることはできません。",
        "perspectives": [
          "限られた資源で助かる見込みを重視する考えがあります。",
          "残される人の生活まで考える配分もあります。"
        ],
        "question": "助かる見込みと家族への影響のうち、どの事情を重く考えましたか。ほかに必要だと思う条件はありますか。"
      },
      "relations": [],
      "followUps": [
        "fu_reason_conditions"
      ],
      "review": {
        "humanReviewed": false,
        "notes": [
          "家族背景を自分との親しさと同一視しないため、公平↔関係は採点しない。",
          "2026-09-17 編集レビュー：家族への影響を平等と同一視できないため軸採点を行わない。"
        ]
      }
    },
    {
      "id": "q003",
      "version": 2,
      "status": "editorial_draft",
      "kind": "choice",
      "title": "会社のルール",
      "body": "職場の申請手順を省くと、今日中に顧客の困りごとを解決できます。安全や費用は変わりませんが、例外を認めると担当者によって対応が違ってしまいます。正式な変更には一週間かかります。",
      "category": [
        "work"
      ],
      "axes": [
        "principle_outcome"
      ],
      "importance": 1,
      "scoringMode": "behavior",
      "options": [
        {
          "id": "A",
          "label": "今回は例外で対応し、あとで手順の変更を提案する",
          "weights": {
            "principle_outcome": 0.7
          }
        },
        {
          "id": "B",
          "label": "今回は正式な手順を守り、次回に向けて改善する",
          "weights": {
            "principle_outcome": -0.7
          }
        },
        {
          "id": "unsure",
          "label": "この条件だけでは決められない",
          "weights": {},
          "isNonAnswer": true
        }
      ],
      "reflection": {
        "summary": "目の前の改善と、誰に対しても同じ手順を使うことの比較です。",
        "perspectives": [
          "例外があれば、今困っている人に早く対応できます。",
          "手順が一定なら、担当者による扱いの差を減らせます。"
        ],
        "question": "今回、どの条件が判断を左右しましたか。"
      },
      "relations": [],
      "followUps": [
        "fu_reason_conditions"
      ],
      "review": {
        "humanReviewed": false,
        "notes": [
          "2026-09-17 編集レビュー：両案とも改善を提案するため安定↔変化の採点を外す。"
        ]
      }
    },
    {
      "id": "q004",
      "version": 2,
      "status": "editorial_draft",
      "kind": "choice",
      "title": "拾った一万円",
      "body": "落とし主を示すものがない一万円を拾い、届け出ました。架空の制度では、保管期間が終わると受け取るか、公的な支援基金へ回すかを選べます。どちらも正式に認められています。あなたならどうしますか。",
      "category": [
        "personal"
      ],
      "axes": [
        "principle_outcome"
      ],
      "importance": 1,
      "scoringMode": "behavior",
      "options": [
        {
          "id": "A",
          "label": "認められた受取人として受け取る",
          "weights": {}
        },
        {
          "id": "B",
          "label": "受け取らず、支援基金へ回す",
          "weights": {}
        },
        {
          "id": "unsure",
          "label": "この条件だけでは決められない",
          "weights": {},
          "isNonAnswer": true
        }
      ],
      "reflection": {
        "summary": "どちらも制度上認められた使い道です。選んだ配分だけでは、何を大切にしたかは分かりません。",
        "perspectives": [
          "自分の暮らしや使い道を考えて、受け取る判断があります。",
          "基金の使い道や支援への思いから、回す判断もあります。"
        ],
        "question": "このお金をどう使いたいと思いましたか。制度上の権利や、自分・周囲の事情は関わりましたか。"
      },
      "relations": [],
      "followUps": [
        "fu_reason_conditions"
      ],
      "review": {
        "humanReviewed": false,
        "notes": [
          "持ち去りを模範解答と対比しないため、届け出後の配分を問う。原題からの変更は公開前レビュー対象。",
          "2026-09-17 編集レビュー：両案とも制度上認められ、原則重視と結果重視に分けられないため採点しない。"
        ]
      }
    },
    {
      "id": "q005",
      "version": 1,
      "status": "editorial_draft",
      "kind": "choice",
      "title": "9人と1人",
      "body": "十人で使う施設の開館時間を変更すると、九人は使いやすくなりますが、一人は利用できなくなります。予算上、時間の延長や代替サービスはできません。現在の時間なら十人とも利用できますが、九人には負担があります。",
      "category": [
        "society"
      ],
      "axes": [
        "individual_collective"
      ],
      "importance": 1,
      "scoringMode": "behavior",
      "options": [
        {
          "id": "A",
          "label": "一人も利用できなくならないよう、現在の時間を保つ",
          "weights": {
            "individual_collective": -0.8
          }
        },
        {
          "id": "B",
          "label": "九人の負担を減らすため、時間を変更する",
          "weights": {
            "individual_collective": 0.8
          }
        },
        {
          "id": "unsure",
          "label": "この条件だけでは決められない",
          "weights": {},
          "isNonAnswer": true
        }
      ],
      "reflection": {
        "summary": "多くの人の改善と、一人が利用を失うことを比べます。",
        "perspectives": [
          "少数の人にも利用できる状態を残す考えがあります。",
          "日々の負担を人数も含めて考える立場があります。"
        ],
        "question": "今回、どの条件が判断を左右しましたか。"
      },
      "relations": [],
      "followUps": [],
      "review": {
        "humanReviewed": false,
        "notes": [
          "2026-09-17 編集レビュー：利用目的と九人の負担の程度が未指定。条件を具体化した版の追加は実プレイで確認してから検討する。"
        ]
      }
    },
    {
      "id": "q006",
      "version": 2,
      "status": "editorial_draft",
      "kind": "choice",
      "title": "創作に使う一年",
      "body": "以前から取り組みたい創作の仕事があります。安定した仕事を続けるか、一年間だけ創作の仕事に挑戦するか選べます。生活費の蓄えは一年分ありますが、成功は保証されず、元の職場には戻れません。どちらを選びますか。",
      "category": [
        "personal"
      ],
      "axes": [
        "stability_change"
      ],
      "importance": 1,
      "scoringMode": "behavior",
      "options": [
        {
          "id": "A",
          "label": "一年間、創作の仕事に挑戦する",
          "weights": {
            "stability_change": 0.8
          }
        },
        {
          "id": "B",
          "label": "今の仕事を続け、余暇で創作する",
          "weights": {
            "stability_change": -0.8
          }
        },
        {
          "id": "unsure",
          "label": "この条件だけでは決められない",
          "weights": {},
          "isNonAnswer": true
        }
      ],
      "reflection": {
        "summary": "挑戦の機会と、続けられる生活の形を比べます。",
        "perspectives": [
          "期限を決めた挑戦でしか分からないことがあります。",
          "生活を保つことで、長く創作を続けられる場合もあります。"
        ],
        "question": "今回、どの条件が判断を左右しましたか。"
      },
      "relations": [],
      "followUps": [],
      "review": {
        "humanReviewed": false,
        "notes": [
          "2026-09-17 編集レビュー：題名を中立化し、創作に取り組みたい本人の意思を前提として明示する。"
        ]
      }
    },
    {
      "id": "q007",
      "version": 2,
      "status": "editorial_draft",
      "kind": "choice",
      "title": "親友と他人",
      "body": "架空の救助場面です。親友一人のいる側と、面識のない人一人のいる側があり、片側だけを救助できます。どちらも全員を確実に助けられ、年齢・危険度・所要時間は同じです。あなたはどちらを選びますか。",
      "category": [
        "life"
      ],
      "axes": [
        "fairness_relationship"
      ],
      "importance": 1,
      "scoringMode": "behavior",
      "options": [
        {
          "id": "A",
          "label": "親友のいる側を助ける",
          "weights": {}
        },
        {
          "id": "B",
          "label": "面識のない人のいる側を助ける",
          "weights": {}
        },
        {
          "id": "unsure",
          "label": "この条件だけでは決められない",
          "weights": {},
          "isNonAnswer": true
        }
      ],
      "reflection": {
        "summary": "同じ条件の命を前に、関係が選択にどう関わるかを考えます。",
        "perspectives": [
          "共に過ごした相手に特別な責任を感じることがあります。",
          "面識の有無を優先の根拠にしない考えもあります。"
        ],
        "question": "今回、どの条件が判断を左右しましたか。"
      },
      "relations": [],
      "followUps": [
        "fu_reason_rescue",
        "fu_friend_boundary"
      ],
      "review": {
        "humanReviewed": false,
        "notes": [
          "他人を選ぶ理由を公平と断定しない。理由追問と併読しweightは暫定。",
          "2026-09-17 編集レビュー：選択だけで公平さや関係重視を特定しない。理由と人数条件の違いを読む。"
        ]
      },
      "scenario": {
        "seriesId": "rescue_friend_count",
        "variable": "strangerCount",
        "value": 1,
        "unit": "人",
        "constants": {
          "closePerson": "friend",
          "closeCount": 1,
          "certainty": 1,
          "equalAgeRiskTime": true
        },
        "decisionMap": {
          "A": "close",
          "B": "strangers"
        }
      }
    },
    {
      "id": "q008",
      "version": 2,